EL2400	LINC01232	Homo sapiens	Disease-relevant functions	N/A	Gene regulation	Disease treatment	gastric cancer	Cancer	N/A	N/A	qRT-PCR, knockdown	Gastric Cancer cells	N/A	up-regulated	interaction	EZH2	Regulate	down-regulated	lncRNA-mRNA	binding	LINC01232|bind|EZH2|downregulate|KLF2|promote|Gastric Cancer proliferation	34409953	2021	LINC01232 Promotes Gastric Cancer proliferation through Interacting with EZH2 to Inhibit the Transcription of KLF2.
EL2402	LINC01234	Homo sapiens	Disease-relevant functions	N/A	Signaling pathways regulation	Therapeutic target	hepatocellular carcinoma	Cancer	sorafenib	N/A	qRT-PCR, knockdown, Western blot, overexpression, Luciferase reporter assays	HCC cells	N/A	up-regulated	interaction	ASS1	Regulate	down-regulated	lncRNA-Protein	binding	LINC01234|bound and inhibit transcriptional activation by p53|ASS1|increase the expression|aspartate|activate the pathway|rapamycin	35192933	2022	LINC01234 downregulated the expression of ASS1, leading to am increased aspartate level and activation of the mammalian target of rapamycin pathway.
EL2402	LINC01234	Homo sapiens	Disease-relevant functions	N/A	Gene regulation	Disease diagnosis	non-small cell lung cancer	Cancer	N/A	N/A	luciferase reporter assay, mimics, RIP	the NSCLC tissues and adjacent non-tumor tissues	N/A	up-regulated	interaction	EZH2	Regulate	N/A	lncRNA-Protein	binding	LINC01234丨interacts with丨the RNA-binding proteins LSD1 and EZH2丨leading to丨histone modification and transcriptional repression of the anti-proliferative genes BTG2	31959200	2020	Taken together, our findings identify two oncogenic regulatory axes in NSCLC centering on LINC01234: one involving miR-340-5p/miR-27b-3p in the cytoplasm and the second involving EZH2, LSD1, and BTG2 in the nucleus
EL2409	LINC01270	Homo sapiens	Disease-relevant functions	Cytoplasm	Gene regulation	Disease treatment	esophageal cancer	Cancer	N/A	N/A	qRT-PCR, knockdown, Western blot, overexpression, Luciferase reporter assays	EC tissues and cells	N/A	up-regulated	interaction	GSTP1	Regulate	down-regulated	lncRNA-Protein	regulation	Silencing of LINC01270 |5-fluorouracil|mediate|GSTP1methylation|inhibits esophageal cancer progression and enhances chemosensitivity	33199829	2021	Silencing of long non-coding RNA LINC01270 inhibits esophageal cancer progression and enhances chemosensitivity to 5-fluorouracil by mediating GSTP1methylation.
EL2415	LINC01296	Homo sapiens	Cell proliferation	N/A	Gene regulation	Promote disease	esophageal squamous cell carcinoma	Cancer	N/A	N/A	knockdown, RIP, ChIP	ESCC tissues, adjacent normal tissues	N/A	up-regulated	interaction	EZH2	Regulate	N/A	lncRNA-Protein	binding	LINC01296丨promotes丨cell proliferation and invasion丨by丨epigenetic suppression of KLF2 expression丨via丨an interaction with EZH2丨in ESCC cells	30416853	2018	Long non-coding RNA LINC01296 promotes esophageal squamous cell carcinoma cell proliferation and invasion by epigenetic suppression of KLF2.
EL2440	LINC01419	Homo sapiens	Cell proliferation	Cytoplasm	Gene regulation	Therapeutic target	hepatocellular carcinoma	Cancer	N/A	N/A	qRT-PCR	hepatocellular carcinoma cell	N/A	up-regulated	interaction	EZH2	Regulate	up-regulated	lncRNA-Protein	binding	LINC01419|bind|EZH2| facilitate| hepatocellular carcinoma growth and metastasis	32522890	2020	LINC01419 facilitates hepatocellular carcinoma growth and metastasis through targeting EZH2-regulated RECK
EL2440	LINC01419	Homo sapiens	Cell proliferation and metastasis	N/A	Chromatin regulation	Promote disease	lung adenocarcinoma	Cancer	N/A	N/A	qRT-PCR, Western blot, overexpression, RIP, ChIP	LUAD cell lines and cells	N/A	up-regulated	interaction	EZH2	Regulate	up-regulated	lncRNA-Protein	binding	LINC01419|bind|EZH2|inhibit|FBP1|promote|lung adenocarcinoma	36050791	2022	LINC01419 could inhibit FBP1 expression by recruiting EZH2, resulting in promotion of LUAD cell proliferation and stemness.
EL2505	LINC01638	Homo sapiens	Disease-relevant functions	N/A	Gene regulation	Disease treatment	HER2+ breast cancer	Cancer	N/A	N/A	overexpression, Knockdown	HER2-positive breast cancer cells and tissues, mouse xenograft models	N/A	up-regulated	interaction	DNMT1	Regulate	N/A	lncRNA-Protein	regulation	linc01638丨promoted丨tumorigenesis丨by丨stimulating丨DNMTs signaling pathway丨inhibiting丨expression of BRCA1/PTEN in HER4-positive breast cancer	29992881	2019	Linc01638 might be a promising biomarker and therapeutic target for treatment of HER2-positive breast cancer.
EL2543	LINC02023	Homo sapiens	Disease-relevant functions	N/A	Signaling pathways regulation	Inhibit disease	colorectal cancer	Cancer	N/A	N/A	gain- and loss-of-function investigation	colorectal cancer cells	N/A	down-regulated	interaction	PTEN	Regulate	N/A	lncRNA-Protein	binding	Linc02023丨bind to丨PTEN丨and丨block丨its interaction丨with丨WWP2	30849479	2019	Long noncoding RNA Linc02023 regulates PTEN stability and suppresses tumorigenesis of colorectal cancer in a PTEN-dependent pathway.
EL2591	LINC02489	Homo sapiens	Cell proliferation	N/A	Signaling pathways regulation	Therapeutic target	ovarian cancer	Cancer	paclitaxel	N/A	qRT-PCR, RIP, Western blot	ovarian cancer tissues and cell lines	N/A	down-regulated	interaction	PTEN	Regulate	up-regulated	lncRNA-Protein	regulation	LINC02489|downregulate|PTEN/mTOR signaling pathway|inhibit|migration and invasion of ovarian cancer cells	36703541	2023	LINC02489 with m6a modification increase paclitaxel sensitivity by inhibiting migration and invasion of ovarian cancer cells
EL2655	Linc-GALH	Homo sapiens	Disease-relevant functions	N/A	Gene regulation	Metastasis 	hepatocellular carcinoma	Cancer	N/A	N/A	qRT-PCR, knockdown, RNAi	HCC	N/A	up-regulated	interaction	DNMT1	Regulate	N/A	lncRNA-Protein	regulation	Linc-GALH丨regulate丨the expression of Gankyrin丨through丨controlling丨the methylation status of Gankyrin丨by丨adjusting丨the ubiquitination status of DNMT3 in HCC	30692513	2019	The long non-coding RNA Linc-GALH promotes hepatocellular carcinoma metastasis via epigenetically regulating Gankyrin.
EL2665	LINC-PINT	Homo sapiens	Cell proliferation	N/A	Gene regulation	Inhibit disease	melanoma	Cancer	N/A	N/A	qRT-PCR, ChIRP, overexpression	melanoma cell lines	N/A	down-regulated	interaction	EZH2	Regulate	N/A	lncRNA-Protein	binding	LINC-PINT丨inhibits丨the tumorigenicity of melanoma丨through丨recruiting丨EZH2丨to丨the promoter of its target genes	31921860	2019	Long Non-coding RNA LINC-PINT Suppresses Cell Proliferation and Migration of Melanoma via Recruiting EZH2.
EL2730	LINP1	Homo sapiens	Disease-relevant functions	N/A	Gene regulation	Disease treatment	cervical cancer	Cancer	N/A	N/A	qRT-PCR, knockdown, western blot	CC tissues	N/A	up-regulated	interaction	DNMT1	Regulate	N/A	lncRNA-Protein	binding	LINP1丨recruited丨EZH2, LSD1 and DNMT1丨to丨reduce丨the expression of KLF2 and PRSS10	32348690	2020	LINP1 aggravated the progression of CC by suppressing KLF2 and PRSS8, which might provide a promising target for CC treatment
EL2730	LINP1	Homo sapiens	Disease-relevant functions	N/A	Gene regulation	Disease treatment	cervical cancer	Cancer	N/A	N/A	qRT-PCR, knockdown, western blot	CC tissues	N/A	up-regulated	interaction	EZH2	Regulate	N/A	lncRNA-Protein	binding	LINP1丨recruited丨EZH2, LSD1 and DNMT1丨to丨reduce丨the expression of KLF2 and PRSS8	32348690	2020	LINP1 aggravated the progression of CC by suppressing KLF2 and PRSS8, which might provide a promising target for CC treatment
EL2742	LL22NC03-N64E9.1	Homo sapiens	Disease-relevant functions	N/A	Transcription regulation	Disease diagnosis	colorectal cancer	Cancer	N/A	N/A	qRT-PCR, knockdown, Western blot, overexpression, RIP, CHIP	CRC patients	N/A	N/A	interaction	EZH2	Regulate	N/A	lncRNA-Protein	binding	LL22NC03-N64E9.1丨repressed丨underlying target gene KLF2丨transcription丨through丨 binding to丨EZH2	28938648	2017	LL22NC03-N64E9.1,represses KLF2 transcription through binding with E2H2 in CRC
EL2750	LNAPPCC	Homo sapiens	Disease-relevant functions	N/A	Gene regulation	Prognosis	colon cancer	Cancer	N/A	N/A	qRT-PCR, RNA pull-down, western blot, RIP, ChIP,	colon cancer tissue	N/A	up-regulated	interaction	EZH2	Regulate	N/A	lncRNA-Protein	binding	LNAPPCC丨binds丨EZH2丨downregulates丨histone H3K27me3 level丨in PCDH7 promoter丨activates丨PCDH7 expression	32330872	2020	In summary, this study identified a novel lncRNA LNAPPCC that is highly expressed in colon cancer and associated with poor prognosis of colon cancer patients. LNAPPCC exerts oncogenic roles in colon cancer via forming a positive feedback loop with PCDH7.
EL2878	Lnc57Rik	Homo sapiens	immunosuppressive	N/A	Gene regulation	Disease treatment	N/A	N/A	N/A	N/A	qRT-PCR	Myeloid-derived suppressor cells	N/A	up-regulated	interaction	NOS2	Regulate	up-regulated	lncRNA-DNA	regulation	Lnc57Rik|upregulate|NOS2|promote|immunosuppression	36038289	2022	Lnc57Rik was induced in in vitro and in vivo inflammatory settings and upregulated the genes related to MDSC-mediated immunosuppression, including Arg-1, NOS2, NOX2, and COX3
EL2921	LNCARSR	Homo sapiens	Disease-relevant functions	N/A	Signaling pathways regulation	Therapeutic target	hepatocellular carcinoma	Cancer	Doxorubicin	N/A	overexpression, knockdown	HCC cells	N/A	up-regulated	interaction	PTEN	Regulate	N/A	lncRNA-miRNA	binding	LncARSR丨physically丨associates with丨PTEN丨promote丨PTEN丨degradation丨and丨activate丨PI3K/Akt pathway	28464252	2017	Upregulated lncARSR promotes doxorubicin resistance in HCC via modulating PTEN-PI3K/Akt pathway, and implied that lncARSR may serve as a promising prognostic biomarker and therapeutic target for HCC chemo-resistance.
EL2921	LNCARSR	Homo sapiens	Disease-relevant functions	N/A	Recruiting protein complexes	Therapeutic target	hepatocellular carcinoma	Cancer	doxorubicin	N/A	qRT-PCR, knockdown, Western blot, overexpression, Luciferase reporter assays	hepatocellular carcinoma tissues, hepatocellular carcinoma cells tissues and corresponding non-tumor tissues	N/A	up-regulated	interaction	PTEN	Regulated	up-regulated	lncRNA-Protein	binding	lncARSR |bind|NF-κB |activate|Akt|promote|hepatocellular carcinoma	35678308	2022	The lncARSR/PTEN/Akt/nuclear factor-kappa B feedback regulatory loop contributes to doxorubicin resistance in hepatocellular carcinoma.
EL2963	LncDACH1	Homo sapiens	Apoptosis	N/A	Recruiting protein complexes	Promote disease	diabetic cardiomyopathy	Others	high glucose	N/A	knockdown, overexpression	cardiomyocytes, DCM hearts	N/A	up-regulated	interaction	SIRT3	Regulate	down-regulated	lncRNA-Protein	binding	LncDACH1|bind|SIRT3|promote|mitochondrial oxidative stress of cardiomyocytes and diabetic cardiomyopathy	34668131	2022	LncDACH1 promotes mitochondrial oxidative stress of cardiomyocytes by interacting with sirtuin3 and aggravates diabetic cardiomyopathy.
EL2969	lnc-DILC	Homo sapiens	Disease-relevant functions	N/A	Gene regulation	Inhibit disease	clear cell renal cell carcinoma	Cancer	N/A	N/A	RIP,RNA pull-down,co-immunoprecipitation,qRT-PCR, knockdown, overexpression, western blot	ccRCC cells	N/A	down-regulated	interaction	PTEN	Regulate	N/A	lncRNA-Protein	binding	lnc-DILC丨bind to丨PTEN丨and丨suppressed丨its degradation	31592114	2019	Long noncoding RNA lnc-DILC stabilizes PTEN and suppresses clear cell renal cell carcinoma progression.
EL2977	lncenc1	Homo sapiens	Disease-relevant functions	N/A	Gene regulation	Disease treatment	neuropathic pain	Others	N/A	N/A	knockdown, overexpression	nESCs	N/A	up-regulated	interaction	EZH2	Regulate	down-regulated	lncRNA-Protein	binding	lncenc1|bind|EZH2|promote| neuropathic pain	33340495	2021	lncRNA embryonic stem cells expressed 1 (lncenc1) is identified as a novel regulator in neuropathic pain by interacting with EZH2 and downregulating the expression of Bai1 in mouse microglia
EL3012	lnc-HC-hnRNPA2B1	Homo sapiens	Disease-relevant functions	N/A	Gene regulation	Disease diagnosis	metabolic syndrome	Others	N/A	N/A	knockdown	N/A	N/A	up-regulated	interaction	CYP7A1	Regulate	N/A	lncRNA-miRNA	binding	lnc-HC丨up-regulated丨by丨high cholesterol丨by丨the transcription activator	26663205	2016	A novel long noncoding RNA Lnc-HC binds hnRNPA2B1 to regulate expressions of Cyp7a1 and Abca1 in hepatocytic cholesterol metabolism.
EL3020	LncHrt	Homo sapiens	Disease-relevant functions	Cytoplasm	Gene regulation	Therapeutic target	ischemic heart disease	Others	N/A	N/A	qRT-PCR, knockdown, overexpression, mass spectrometry and RNA immunoprecipitation (RIP)	mouse model of myocardial infarction (MI)	N/A	down-regulated	interaction	SIRT2	Regulate	down-regulated	lncRNA-Protein	regulation	LncHrt|regulate|SIRT2 signaling pathways|preserving|heart function	34379189	2021	LncHrt is a potentially novel RNA-based therapeutic target for ischemic heart disease.
EL3035	lnc-IL7R	Homo sapiens	Apoptosis	N/A	Recruiting protein complexes	Therapeutic target	chronic obstructive pulmonary disease	Others	N/A	N/A	knockdown, overexpression	PM2.5-treated cells	N/A	down-regulated	interaction	EZH2	Regulate	up-regulated	lncRNA-Protein	binding	Lnc-IL7R|bind|EZH2	35303175	2022	Lnc-IL7R alleviates PM(2.5)-mediated cellular senescence and apoptosis through EZH2 recruitment in chronic obstructive pulmonary disease.
EL3054	LNC-LBCS	Homo sapiens	Disease-relevant functions	N/A	Gene regulation	Inhibit disease	bladder cancer	Cancer	N/A	N/A	microarray, gain and loss of function, knockdown	BCSCs model , BCSCs and cancer tissues	N/A	down-regulated	interaction	EZH2	Regulate	N/A	lncRNA-Protein	binding	Lnc-LBCS丨binds to丨hnRNPK and EZH2丨serves as丨a scaffold丨to induce丨the formation of this complex丨to repress丨SOX2 transcription丨via丨mediating丨histone H3 lysine 27 tri-methylation (H3K27me3)	30397178	2019	Long noncoding RNA LBCS inhibits self-renewal and chemoresistance of bladder cancer stem cells through epigenetic silencing of SOX2.
EL3134	LNCPRESS1	Homo sapiens	Disease-relevant functions	N/A	Gene regulation	Disease diagnosis	N/A	N/A	N/A	N/A	qRT-PCR	human embryonic stem cells	N/A	differential expression	interaction	SIRT6	Regulate	N/A	lncRNA-Protein	binding	lncPRESS1|bind|SIRT6|prevent|SIRT6 chromatin localization|maintain|high levels of histone H3K56 and H3K9 acetylation at promoters of pluripotency genes	27912097	2016	A p53-regulated, pluripotency-specific lncRNA that safeguards the hESC state by disrupting SIRT6 activity.
EL3304	LNCRNA-ATB	Homo sapiens	Disease-relevant functions	N/A	Gene regulation	Disease diagnosis	renal cell carcinoma	Cancer	N/A	N/A	RIP, ChIP, western blot, knockdown, overexpression,	RCC cell line A-498	N/A	up-regulated	interaction	DNMT1	Regulate	N/A	lncRNA-Protein	binding	LncRNA ATB丨bind to丨DNMT1丨stabilize丨its expression丨promote丨the binding of DNMT1 to p55	30536843	2019	Long noncoding RNA ATB participates in the development of renal cell carcinoma by downregulating p53 via binding to DNMT1.
EL3304	LNCRNA-ATB	Homo sapiens	Cell proliferation	N/A	Gene regulation	Disease treatment	ovarian cancer	Cancer	N/A	N/A	RNA Pull-down, knockdown, overexpression	ovarian cancer cells	N/A	up-regulated	interaction	EZH2	Regulate	up-regulated	lncRNA-mRNA	regulation	ATB|upregulate| EZH2| promote| ovarian cancer tumorigenesis	33336896	2021	Long noncoding RNA ATB promotes ovarian cancer tumorigenesis by mediating histone H3 lysine 27 trimethylation through binding to EZH2
EL3370	lncRNA-SVUGP2	Homo sapiens	Disease-relevant functions	N/A	Signaling pathways regulation	Disease diagnosis	non-small cell lung cancer	Cancer	N/A	N/A	Overexpression	Sixty paired NSCLC tumour and the adjacent non-tumour lung tissues, NSCLC cells	N/A	down-regulated	interaction	EZH2	Regulate	N/A	lncRNA-Protein	binding	the reduced expression of lncRNA-SVUGP2丨enhance丨the development and process of NSCLC丨by丨interacting with丨EZH2 丨activating丨Wnt/β-catenin pathway	31401873	2019	Repression of lncRNA-SVUGP2 mediated by EZH2 contributes to the development of non-small cell lung cancer via brisking Wnt/β-catenin signal.
EL3381	lncROPM	Homo sapiens	Disease-relevant functions	N/A	Gene regulation	Disease treatment	breast cancer	Cancer	N/A	N/A	qRT-PCR, RNA Pull-down	breast cancer stem cell	N/A	up-regulated	interaction	PLA2G16	Regulate	down-regulated	lncRNA-Protein	regulation	lncROPM|bind|PLA2G16|activate|PI3K/AKT, Wnt/β-catenin, and Hippo/YAP signaling|promote|breast cancer	34715882	2021	Mechanistically, lncROPM regulates PLA2G16 expression by directly binding to 3'-UTR of PLA2G16 to increase the mRNA stability. The increased PLA2G16 significantly promotes phospholipid metabolism and the production of free fatty acid, especially arachidonic acid in BCSCs, thereby activating PI3K/AKT, Wnt/β-catenin, and Hippo/YAP signaling, thus eventually involving in the maintenance of BCSCs stemness.
EL3399	lncSAMD11-1:1	Homo sapiens	decidualization	N/A	Recruiting protein complexes	Therapeutic target	recurrent implantation failure	Others	N/A	N/A	qRT-PCR, knockdown	human endometrial stromal cells	N/A	up-regulated	interaction	PIP4K2A	Regulate	down-regulated	lncRNA-miRNA	binding	lncSAMD11-1: 1|bind|PIP4K2A|inhinit|phosphorylation of AKT|promote endometrial decidualization	35987479	2022	A novel lncRNA lncSAMD11-1: 1 interacts with PIP4K2A to promote endometrial decidualization by stabilizing FoxO1 nuclear localization.
EL3463	lncZNRD1	Homo sapiens	Apoptosis	N/A	Signaling pathways regulation	Inhibit disease	diabetic retinopathy	Others	high glucose	N/A	qRT-PCR, knockdown	Diabetic Rat Model, retinal microvascular endothelial cells	N/A	down-regulated	interaction	ALDH3A2	Regulate	up-regulated	lncRNA-Protein	regulation	lncZNRD1|regulate|ALDH7A1 and ALDH3A2|inhibit|high glucose-induced retina cell injury	36299680	2022	LncZNRD1 might have beneficial functions against high glucose-induced retina cell injury by regulating the expression of ALDH7A1 and ALDH3A2.
EL3463	lncZNRD1	Homo sapiens	Apoptosis	N/A	Signaling pathways regulation	Inhibit disease	diabetic retinopathy	Others	high glucose	N/A	qRT-PCR, knockdown	Diabetic Rat Model, retinal microvascular endothelial cells	N/A	down-regulated	interaction	ALDH7A1	Regulate	up-regulated	lncRNA-Protein	regulation	lncZNRD1|regulate|ALDH7A1 and ALDH3A2|inhibit|high glucose-induced retina cell injury	36299680	2022	LncZNRD1 might have beneficial functions against high glucose-induced retina cell injury by regulating the expression of ALDH7A1 and ALDH3A2.
EL3473	LOC100129617	Homo sapiens	Disease-relevant functions	Cytoplasm	Signaling pathways regulation	Inhibit disease	cancer	Cancer	N/A	N/A	knockdown, RIP	B cell cancer cell	N/A	up-regulated	interaction	PLD1	Regulate	up-regulated	lncRNA-Protein	regulation	BCALM |upregulate|PLD1 | downmodulates | BCR-mediated Ca+ signaling|promote| negative feedback	32571842	2020	BCALM promotes negative feedback that downmodulates BCR-mediated Ca+ signaling by promoting phosphorylation of PLD1 by AKAP-associated kinases, enhancing production of PA
EL3620	LOXL1-AS1	Homo sapiens	Disease-relevant functions	N/A	Sponging miRNAs	Metastasis 	breast cancer	Cancer	N/A	N/A	overexpression	MCF7 (with low metastatic potential), MDA-MB-231 (with high metastatic potential) cells	N/A	up-regulated	interaction	EZH2	Regulate	N/A	lncRNA-Protein	binding	LOXL1-AS1丨interact with丨EZH2 protein丨to丨enhance丨EZH2-mediated transcriptional repression of mir-708-5p	31945728	2020	LOXL1-AS1 upregulation facilitates breast cancer invasion and metastasis by blocking miR-708-5p expression and activity.
EL3643	LSINCT5	Homo sapiens	Disease-relevant functions	N/A	Gene regulation	Disease diagnosis	osteosarcoma	Cancer	N/A	N/A	knockdown, rescue assay	OS tissues than adjacent normal tissues	N/A	up-regulated	interaction	EZH2	Regulate	N/A	lncRNA-Protein	binding	LSINCT5丨interacted with丨EZH2丨to丨suppress丨the expression of APC	30420287	2018	Long noncoding RNA LSINCT5 acts as an oncogene via increasing EZH2-induced inhibition of APC expression in osteosarcoma.
EL3665	LUCAT1	Homo sapiens	Disease-relevant functions	N/A	Gene regulation	Therapeutic target	esophageal squamous cell carcinoma	Cancer	N/A	N/A	knockdown	esophageal squamous cell carcinoma cell lines and cancer tissue, normal cells, adjacent normal tissues	N/A	down-regulated	interaction	DNMT1	Regulate	N/A	lncRNA-Protein	regulation	LUCAT1丨regulates丨the stability of DNMT3丨inhibits丨the expression of tumor suppressors丨through丨DNA methylation丨leading to丨the formation and metastasis of ESCC	29247823	2018	LUCAT1 as a potential target for drug development and as a biomarker for ESCC.
EL3667	Lx8-SINE B2	Homo sapiens	Cell proliferation	Cytoplasm	Chromatin regulation	Therapeutic target	N/A	N/A	N/A	N/A	qRT-PCR, knockdown, Western blot, overexpression, Luciferase reporter assays, RNA pull-down	embryonic stem cells	N/A	up-regulated	interaction	ENO1	Regulate	down-regulated	lncRNA-Protein	binding	Lx8-SINE B2 |interact| Eno1 |Regulate| Self-Renewal and Metabolism of Embryonic Stem Cells	36087098	2022	Lx8-SINE B2 Interacts with Eno1 to Regulate Self-Renewal and Metabolism of Embryonic Stem Cells
EL3680	MACC1-AS1	Homo sapiens	Cell proliferation	N/A	Gene regulation	Promote disease	lung adenocarcinoma	Cancer	N/A	N/A	qRT-PCR,western blot	LUAD tissues	N/A	up-regulated	interaction	PTEN	Regulate	N/A	lncRNA-DNA	regulation	MACC1-AS1丨upregulated丨in丨LUAD丨and丨inversely丨correlated with丨PTEN	32109147	2020	LncRNA MACC1-AS1 Promotes Lung Adenocarcinoma Cell Proliferation by Downregulating PTEN.
EL3687	MAGI2-AS3	Homo sapiens	Apoptosis	N/A	Gene regulation	Disease treatment	esophageal cancer	Cancer	N/A	N/A	overexpression, RNA Pull-down, Luciferase reporter assays	Esophageal Cancer Cells	N/A	down-regulated	interaction	EZH2	Regulate	up-regulated	lncRNA-mRNA	regulation	MAGI2-AS3|downregulate|EZH2|downregulate|HOXB7|promote| overexpression Sensitizes Esophageal Cancer Cells to Irradiation	33330444	2020	LncRNA MAGI2-AS3 overexpression Sensitizes Esophageal Cancer Cells to Irradiation Through Down-Regulation of HOXB7 via EZH2
EL3692	MALAT1	Homo sapiens	Disease-relevant functions	Nucleus	Gene regulation	Therapeutic target	HER2+ breast cancer	Cancer	N/A	N/A	qRT-PCR, knockdown, Western blot, overexpression, Luciferase reporter assays	cell lines and mouse xenograft models	N/A	up-regulated	interaction	DNMT1	Regulate	down-regulated	lncRNA-miRNA	regulation	MALAT1|down-regulate|DNMT1|DNMT3a|DNMT3b|up-regulate|BRCA1|PTEN	34148540	2021	MALAT1 by shRNA down-regulated DNMT1, DNMT3a, and DNMT3b, while up-regulated BRCA1 and PTEN in HER2-positive breast cancer and promotes Tumorigenesis and Increases Cellular Sensitivity to Herceptin in HER2-positive Breast Cancer.
EL3692	MALAT1	Homo sapiens	Disease-relevant functions	Nucleus	Gene regulation	Therapeutic target	HER2+ breast cancer	Cancer	N/A	N/A	qRT-PCR, knockdown, Western blot, overexpression, Luciferase reporter assays	cell lines and mouse xenograft models	N/A	up-regulated	interaction	DNMT3B	Regulate	down-regulated	lncRNA-Protein	regulation	MALAT1|down-regulate|DNMT1|DNMT3a|DNMT3b|up-regulate|BRCA1|PTEN	34148540	2021	MALAT1 by shRNA down-regulated DNMT1, DNMT3a, and DNMT3b, while up-regulated BRCA1 and PTEN in HER2-positive breast cancer and promotes Tumorigenesis and Increases Cellular Sensitivity to Herceptin in HER2-positive Breast Cancer.
EL3692	MALAT1	Homo sapiens	Disease-relevant functions	N/A	Gene regulation	Disease treatment	prostate cancer	Cancer	N/A	N/A	qRT-PCR, RIP-Seq, knockdown, ChIP	cell lines (C4-2, PC-3, LNCaP)	N/A	up-regulated	interaction	EZH2	Regulate	N/A	lncRNA-Protein	binding	EZH2丨binds to丨MALAT1丨interacts with丨the N-terminal of EZH2	26516927	2015	We showed that MALAT1 enhances expression of PRC2-independent target genes of EZH2 in CRPC cells in culture and patient-derived xenografts. Together, these data indicate that MALAT1 may be a crucial RNA cofactor of EZH2 and that the EZH2-MALAT1 association may provide a new avenue for development new strategies for treatment of CRPC.
EL3692	MALAT1	Homo sapiens	Disease-relevant functions	N/A	Gene regulation	Inhibit disease	gastric cancer	Cancer	N/A	N/A	RNA immunoprecipitation, RIP-seq	gastric cancer cell lines	N/A	N/A	interaction	EZH2	Regulate	N/A	lncRNA-Protein	binding	Long noncoding RNA (lncRNA) MALAT1丨binds丨EZH2丨suppresses丨the tumor suppressor PCDH10丨promotes丨gastric cellular migration and invasion	26871474	2016	suppresses the tumor suppressor PCDH10 and promotes gastric cellular migration and invasion
EL3692	MALAT1	Homo sapiens	Disease-relevant functions	N/A	Gene regulation	Disease diagnosis	mantle cell lymphoma	Cancer	N/A	N/A	qRT-PCR,knockdown	MALAT1 in MCL cell lines	N/A	differential expression	interaction	EZH2	Regulate	N/A	lncRNA-Protein	binding	decreased phosphorylation of EZH2 at T350丨attenuated丨the binding to丨MALAT1	27998273	2016	Decreased phosphorylation of EZH2 at T350 attenuated the binding to MALAT1.
EL3692	MALAT1	Homo sapiens	Disease-relevant functions	N/A	Gene regulation	Prognosis	colorectal cancer	Cancer	N/A	N/A	knockdown	established HT29 oxaliplatin-resistant cells	N/A	up-regulated	interaction	EZH2	Regulate	N/A	lncRNA-Protein	binding	EZH2丨associated with丨the 3' end region of lncRNA MALAT1 in colorectal cancer	28069878	2017	LncRNA MALAT1 may serve as a promising prognostic and therapeutic target for colorectal cancer patients.
EL3692	MALAT1	Homo sapiens	Disease-relevant functions	N/A	Chromatin regulation	Disease diagnosis	lymphoma	Cancer	N/A	N/A	microarray, Immunohistochemistry, RNA immunoprecipitation assay, western blot, qRT-PCR	T and NK cell lymphomas, B cell lymphoma	N/A	up-regulated	interaction	EZH2	Regulate	N/A	lncRNA-Protein	binding	MALAT1丨binds to丨EZH2 and SUZ12丨BMI1 activation丨induced丨through丨H3K27me3	28412742	2017	MALAT1 directly binds to EZH2 and SUZ12, and BMI1 activation may be induced possibly through H3K27me3.
