EL4719	PVT1	Homo sapiens	Disease-relevant functions	N/A	Gene regulation	Disease treatment	pancreatic cancer	Cancer	N/A	N/A	knockdown	pancreatic cancer cells	N/A	up-regulated	interaction	EZH2	Regulate	up-regulated	lncRNA-Protein	binding	HAT1|upregulate|PVT1|bind|EZH2| promote| gemcitabine resistance in pancreatic cancer.	34564701	2021	Histone acetyltransferase 1 promotes gemcitabine resistance by regulating the PVT1/EZH2 complex in pancreatic cancer.
EL4723	PWAR5	Homo sapiens	Cell proliferation	N/A	Transcription regulation	Inhibit disease	glioma	Cancer	N/A	N/A	qRT-PCR	U87, U251 cells, glioma tissues and cell lines.	N/A	down-regulated	interaction	EZH2	Regulate	N/A	lncRNA-Protein	binding	PAR5 expression丨inhibited丨human glioma cell proliferation, invasion and migration丨by丨binding to丨EZH2 丨regulating丨oncogene expression	29048683	2017	Long non-coding RNA PAR5 inhibits the proliferation and progression of glioma through interaction with EZH2.
EL4724	PWAR6	Homo sapiens	Apoptosis	N/A	Gene regulation	Disease treatment	pancreatic ductal adenocarcinoma	Cancer	N/A	N/A	qRT-PCR, knockdown, Western blot, overexpression, Luciferase reporter assays	pancreatic cancer cell lines, PDAC cell	N/A	down-regulated	interaction	EZH2	Regulate	up-regulated	lncRNA-Protein	binding	PWAR6|bind|EZH2|downregulate| YAP1|inhibit|PDAC	33834618	2021	PWAR6 could bind to methyltransferase EZH2, a core component of Polycomb Repressive Complex 2 (PRC2) in regulating gene expression, and scaffold EZH2 to the promoter region of YAP1, resulting in epigenetic repression of YAP1.
EL4731	PYCARD-AS1	Homo sapiens	Disease-relevant functions	N/A	Gene regulation	Disease diagnosis	breast cancer	Cancer	N/A	N/A	knockdown	breast cancer cells	N/A	down-regulated	interaction	DNMT1	Regulate	N/A	lncRNA-Protein	regulation	PYCARD-AS1丨localize to丨the PYCARD promoter丨facilitates丨DNA methylation and H3K9me2 modification 丨by丨recruiting丨the chromatin-suppressor proteins DNMT1 and G11a	31086376	2019	This study reveals a mechanism whereby an lncRNA works at different cellular compartments to regulate the pro-apoptotic gene PYCARD at both the epigenetic and translational levels, contributing to the PYCARD-regulated apoptosis
EL4758	RB1-DT	Homo sapiens	Disease-relevant functions	N/A	Chromatin structure and function regulation	Therapeutic target	gastric cancer	Cancer	N/A	N/A	gain- and loss-of-function, RNA pull-down,RIP	GC cells.	N/A	up-regulated	interaction	DNMT1	Regulate	N/A	lncRNA-Protein	regulation	Linc00441丨recruit丨DNMT1丨to丨the RB1 promoter丨suppressed丨RB3 expression in GC cells	30680063	2018	Linc00441 interacts with DNMT1 to regulate RB1 gene methylation and expression in gastric cancer.
EL4760	RBM5-AS1	Homo sapiens	Apoptosis	N/A	Decoy for hijacking proteins	Therapeutic target	medulloblastoma	Cancer	N/A	N/A	knockdown	radioresistant medulloblastoma cells	N/A	up-regulated	interaction	SIRT6	Regulate	N/A	lncRNA-Protein	binding	RBM5-AS1|bind|SIRT6	34225779	2021	RBM5-AS1 promotes radioresistance in medulloblastoma through stabilization of SIRT6 protein.
EL4817	RNF157-AS1	Homo sapiens	Autophagy	Nucleus	Recruiting protein complexes	Promote disease	epithelial ovarian cancer	Cancer	N/A	N/A	qRT-PCR, knockdown, Western blot, overexpression, Luciferase reporter assays	epithelial ovarian cancer tissues	N/A	up-regulated	interaction	EZH2	Regulate	up-regulated	lncRNA-Protein	binding	RNF157-AS1|bind|EZH2|bind|DIRAS3|promote|epithelial ovarian cancer	36805591	2023	RNF157-AS1 binds to EZH2 to suppress DIRAS3 expression and enhance EOC cell viability by repressing autophagy in a good environment while it also reduces the growth of EOC cells to adapt to a harsh environment by negatively regulating autophagy
EL4830	ROIT	Homo sapiens	Disease-relevant functions	N/A	Gene regulation	Disease diagnosis	diabetes mellitus	Others	N/A	N/A	RNA-seq, Knockdown, Overexpression, qRT-PCR, western blot, RNA pull-down, RIP, CoIP, Luciferase assay, ChIP,	C57BL/6J mice, ob/ob mice (8 weeks old), and db/db mice (8 weeks old) and db/- mice, MIN6 cells	N/A	down-regulated	interaction	DNMT3A	Regulate	N/A	lncRNA-Protein	binding	ROIT丨bound to丨DNA methyltransferase 5a丨caused丨its degradation丨through丨the ubiquitin proteasome pathway	32008054	2020	These findings functionally suggest a novel link between obesity and beta cell dysfunction via ROIT.
EL4831	ROR1-AS1	Homo sapiens	Cell proliferation	N/A	Transcription regulation	Promote disease	colon cancer	Cancer	N/A	N/A	Knockdown, overexpression, qRT-PCR, RIP, CHIP	colon cancer tissues, normal tissues, Colorectal cancer cell lines (HCT116, DLD1, SW480, LOVO) and human normal colon cells (HcoEpic)	N/A	up-regulated	interaction	EZH2	Regulate	N/A	lncRNA-Protein	binding	ROR1-AS1丨bind to丨enhancer of zeste homolog 2 (EZH2)丨inhibit丨the expression of DUSP5	32096171	2020	ROR1-AS1 is highly expressed either in colon cancer tissues or in cell lines, which is able to enhance cell proliferation, accelerate cell cycle, and inhibit cell apoptosis. The mechanism of ROR1-AS1 to participate in the development of colon cancer may be the downregulation of DUSP5 via combination with EZH2.
EL4884	RP11-295G20.2	Homo sapiens	cell growth and autophagy	N/A	Sponging miRNAs	Disease treatment	hepatocellular carcinoma	Cancer	N/A	N/A	qRT-PCR, knockdown, Western blot, overexpression, Luciferase reporter assays	82 TCGA/TCPA-LIHC samples	N/A	up-regulated	interaction	PTEN	Regulate	down-regulated	lncRNA-mRNA	binding	RP11-295G20.2|bind|PTEN|promote|hepatocellular carcinoma	34903728	2021	RP11-295G20.2 regulates hepatocellular carcinoma cell growth and autophagy by targeting PTEN to lysosomal degradation
EL4945	RP11-543C4.3-001	Homo sapiens	Disease-relevant functions	N/A	Gene regulation	Therapeutic target	Alzheimer's disease	Others	N/A	N/A	qRT-PCR, western blot, Knockdown, Overexpression, Luciferase reporter assays, ELISA,	Human neuroblastoma cell line SH-SY5Y cells	N/A	down-regulated	interaction	CYP46A1	Regulate	N/A	lncRNA-DNA	binding	LincRNA丨inhibited丨the activity of the CYP46A3 gene promoter	32038226	2020	This study indicates a possible novel role of LincRNA and provides a new way to look into the relationship between CYP46A1 polymorphism and AD pathology.
EL5020	RP4-694A7.2	Homo sapiens	Disease-relevant functions	Nucleus	Gene regulation	Therapeutic target	hepatocellular carcinoma	Cancer	N/A	N/A	qRT-PCR, knockdown, Western blot, overexpression, cell proliferation, colony formation, wound healing, Transwell assays, Fluorescence in-situ hybridization (FISH), tandem mass tag (TMT) analyses, parallel reaction monitoring (PRM), rescue assays, Cell function assays, TMT assay	HCC tissues	N/A	up-regulated	interaction	PSAT1	Regulate	up-regulated	lncRNA-Protein	regulation	RP4-694A7.2|regulate|PSAT1|modulate growth and metastasis	34405023	2021	RP4-694A7.2 Promotes Hepatocellular Carcinoma Cell Proliferation and Metastasis through the Regulation of PSAT1.
EL5036	RPL13AP20	Homo sapiens	Disease-relevant functions	N/A	Transcription regulation	Disease diagnosis	hepatocellular carcinoma	Cancer	N/A	N/A	qRT-PCR, overexpression, knockdown, luciferase reporter assay, mimic	HepG2 cells	N/A	up-regulated	interaction	EZH2	Regulate	N/A	lncRNA-Protein	binding	HANR and mir-214丨regulated丨the EZH2丨affecting丨TGFBR2 level	30342849	2018	HANR/miR-214/EZH2/TGF-β axis, which is implicated in tumorigenesis and progression of HCC.
EL5108	SEMA3B-AS1	Homo sapiens	Cell proliferation	N/A	Transcription regulation	Disease diagnosis	hepatocellular carcinoma	Cancer	N/A	N/A	overexpression	HCC tissues	N/A	down-regulated	interaction	PTEN	Regulate	N/A	lncRNA-Protein	regulation	SEMA3B-AS1丨in丨HCC tissues丨inversely丨correlated with丨miR-718丨and丨 positively丨correlated with丨PTEN	31251699	2019	MiR-718 mediates the indirect interaction between lncRNA SEMA3B-AS1 and PTEN to regulate the proliferation of hepatocellular carcinoma cells.
EL5119	SFTA1P	Homo sapiens	Cell proliferation, Apoptosis	Cytoplasm	Signaling pathways regulation	Promote disease	non-small cell lung cancer	Cancer	N/A	N/A	qRT-PCR, knockdown, Western blot, Luciferase reporter assays, RNA Pull-down	NSCLC cell lines	N/A	up-regulated	interaction	TAZ	Regulate	up-regulated	lncRNA-mRNA	regulation	SFTA1P|upregulate|TAZ expression|activate|Hippo-YAP/TAZ signaling pathway|promote|non-small cell lung cancer	34845189	2021	SFTA1P mediates a positive feedback regulation of the Hippo-YAP/TAZ signaling pathway by targeting TAZ in non-small cell lung cancer.
EL5125	SH3PXD2A-AS1	Homo sapiens	Disease-relevant functions	N/A	Transcription regulation	Promote disease	colorectal cancer	Cancer	N/A	N/A	qRT-PCR, knockdown, overexpression, Rescue assays, RIP, ChIP,	Colorectal Cancer tissues and cells, A nude mice model	N/A	up-regulated	interaction	EZH2	Regulate	N/A	lncRNA-Protein	binding	SH3PXD2A-AS1丨repress丨P57 and KLF2 expression丨through丨interaction with丨EZH2	29734178	2018	Long Non-Coding RNA SH3PXD2A-AS1 Promotes Cell Progression Partly Through Epigenetic Silencing P57 and KLF2 in Colorectal Cancer
EL5156	SIRT1-AS	Homo sapiens	Disease-relevant functions	N/A	Transcription regulation	Therapeutic target	hepatocellular carcinoma	Cancer	N/A	N/A	qRT-PCR, western blot, Northern blot, knockdown	cell line (HCC-9903)	N/A	up-regulated	interaction	SIRT1	Regulate	N/A	lncRNA-RNA	binding	SIRT1-AS|bind|SIRT1|mask|the miR-29c binding site|stabilize|SIRT1	26324025	2015	SIRT1-AS overexpression promoted the proliferation of the human HCC cell lines by upregulating the SIRT1 protein level. The mechanism was that SIRT1-AS bound to SIRT1 mRNA at 3'UTR, masked the miR-29c binding site and stabilized SIRT1 mRNA.
EL5156	SIRT1-AS	Homo sapiens	Disease-relevant functions	N/A	Gene regulation	Disease treatment	vascular endothelialdeep venous thrombosis	Others	N/A	N/A	overexpression	HUVECs	N/A	down-regulated	interaction	SIRT1	Regulate	up-regulated	lncRNA-mRNA	regulation	Sirt1-AS| upregulate| Sirt1| attenuate| aging related deep venous thrombosis	33638947	2021	LncRNA Sirt1-AS upregulates Sirt1 to attenuate aging related deep venous thrombosis
EL5212	SMIM31	Homo sapiens	Disease-relevant functions	N/A	Gene regulation	Disease diagnosis	lung adenocarcinoma	Cancer	N/A	N/A	qRT-PCR, western blot, knockdown, RIP, ChIP	NSCLC tissues and adjacent non-tumor tissues, cell lines(A549)	N/A	up-regulated	interaction	EZH2	Regulate	N/A	lncRNA-Protein	regulation	LINC01207丨bind with丨EZH2丨mediated丨trimethylation of histone 3 lysine 27丨at丨the promoter region of Bad, an important pro-apoptotic gene	26693067	2015	LINC01207 was significantly up-regulated in LAD tissues compared with paired non-tumor tissues, while there was no significant differences between LSCC tissues and adjacent non-tumor tissues. The expression level of LINC01207 was associated with TNM stage of LAD patients, and higher LINC01207 level indicated advanced TNM stage and shorter survival.
EL5230	SNHG1	Homo sapiens	Cell proliferation	N/A	Decoy for hijacking proteins	Promote disease	liver cancer	Cancer	N/A	N/A	qRT-PCR, western blot, Overexpression, knockdown, RIP,ChIP,	LC cell lines SMMC-7721 and SK-HEP-1	N/A	up-regulated	interaction	DNMT1	Regulate	N/A	lncRNA-Protein	binding	SNHG1丨bind to丨DNMT1丨inhibit丨p55 expression	31002127	2019	High expression of SNHG1 could promote proliferative and invasive abilities of LC cells through targeting inhibition of p53 expression by binding to DNMT1.
EL5230	SNHG1	Homo sapiens	Disease-relevant functions	N/A	Chromatin regulation	Promote disease	myocardial injury	Others	N/A	N/A	knockdown	animal and cellular models, myocardial tissues, HL-1 cells	N/A	up-regulated	interaction	DNMT1	Regulate	up-regulated	lncRNA-Protein	binding	SNHG1 |bind| DNMT1| mediate|Bcl-2 methylation| promote|myocardial injury	35678255	2022	LncRNA SNHG1 inhibited Bcl-2 expression by recruiting DNMT1 to Bcl-2 promoter region to cause methylation.
EL5230	SNHG1	Homo sapiens	stem-cell-like sphere formation and the invasion	N/A	Chromatin regulation	Disease treatment	muscle-invasive bladder cancer	Cancer	N/A	N/A	qRT-PCR, knockdown, Western blot, overexpression, Luciferase reporter assays, ChIP, RIP, RNA Pull-down	bladder cancer cell line T24T	N/A	up-regulated	interaction	DNMT3A	Regulate	down-regulated	lncRNA-Protein	binding	SNHG1 | bind | DNMT3A | downregulate | miR-129-2-5p |	36077697	2022	DNMT3A/miR-129-2-5p/Rac1 Is an Effector Pathway for SNHG1 to Drive Stem-Cell-like and Invasive Behaviors of Advanced Bladder Cancer Cells.
EL5230	SNHG1	Homo sapiens	Disease-relevant functions	N/A	Gene regulation	Disease diagnosis	cholangiocarcinoma	Cancer	N/A	N/A	knockdown, RNA-Seq	CCA cell	N/A	up-regulated	interaction	EZH2	Regulate	N/A	lncRNA-Protein	binding	SNHG1丨bound to丨the histone methyltransferase enhancer of the zeste homolog 2丨alterate丨pattern丨on the target genes	29970899	2018	SNHG1 in CCA oncogenesis, in addition to its likely function as a target for CCA interruption
EL5230	SNHG1	Homo sapiens	Cell Differentiation	N/A	Gene regulation	Therapeutic target	N/A	N/A	N/A	N/A	qRT-PCR, Western blot, ChIP, RIP, gain- and loss-of functions assays	periodontal ligament stem cells	N/A	down-regulated	interaction	EZH2	Regulate	N/A	lncRNA-DNA	regulation	SNHG1 | regulate | EZH2 | regulate | histone methylation | in | KLF2 promoter |inhibit| osteogenic differentiation	33028420	2020	SNHG1 inhibited the osteogenic differentiation of PDLSCs through EZH2-mediated H3K27me3 methylation of KLF2 promotor and provided a novel class of therapeutic targets for regenerate dental tissues.
EL5230	SNHG1	Homo sapiens	Cell proliferation	Cytoplasm	Signaling pathways regulation	Disease treatment	prostate cancer	Cancer	N/A	N/A	qRT-PCR, knockdown, Western blot, overexpression, Luciferase reporter assays	PCa cell lines	N/A	up-regulated	interaction	EZH2	Regulate	down-regulated	lncRNA-Protein	regulation	SNHG1 |via EZH2|Regulates| Wnt/β-Catenin and PI3K/AKT/mTOR Signaling Pathways| Affect the Proliferation, Apoptosis, and Autophagy of Prostate Cancer Cell	33194612	2020	Long Non-Coding RNA SNHG1 Regulates the Wnt/β-Catenin and PI3K/AKT/mTOR Signaling Pathways via EZH2 to Affect the Proliferation, Apoptosis, and Autophagy of Prostate Cancer Cell.
EL5234	SNHG12	Homo sapiens	Cell proliferation	Nucleus	Transcription regulation	Disease treatment	renal cell carcinoma	Cancer	N/A	N/A	qRT-PCR, knockdown, ChIP, Western blot, overexpression, Luciferase reporter assays	RCC patients, nude mouse xenograft model, RCC tissues and cells	N/A	up-regulated	interaction	KMT2B	Regulated	up-regulated	lncRNA-Protein	regulation	KMT2B|upregulate|SNHG12|promate|RCC growth and angiogenesis in vivo	35597996	2022	KMT2B promotes the growth of renal cell carcinoma via upregulation of SNHG12 expression and promotion of CEP55 transcription.
EL5238	SNHG14	Homo sapiens	Disease-relevant functions	N/A	Transcription regulation	Promote disease	pancreatic ductal adenocarcinoma	Cancer	N/A	N/A	qRT-PCR, western blot	58 pairs of pancreatic cancer tissues and adjacent normal tissues	N/A	up-regulated	interaction	EZH2	Regulate	N/A	lncRNA-Protein	binding	Downregulation of long noncoding RNA SNHG14丨suppresses丨cell proliferation and invasion丨by丨regulating丨EZH2 in pancreatic ductal adenocarcinoma (PDAC)	31929143	2020	Upregulation of SNHG14 expression promoted cell invasion by affecting E-cadherin expression via interacting with EZH2.
EL5239	SNHG15	Homo sapiens	Disease-relevant functions	N/A	Gene regulation	Metastasis 	gastric cancer	Cancer	N/A	N/A	qRT-PCR,cell transfection,flow cytometry,MTT assay,TUNEL,RIP,ChIP,western blot	pancreatic cancer (PC)tissues	N/A	up-regulated	interaction	EZH2	Regulate	N/A	lncRNA-Protein	binding	SNHG15丨repressed丨the P15 and Kruppel-like factor 2 (KLF2) expression丨via丨binding to丨enhancer of zeste homolog 2 (EZH2)	29137412	2017	SNHG15 expression was also upregulated in PC tissues, and its overexpression was remarkably associated with tumor size, tumor node metastasis (TNM) stage and lymph node metastasis in patients with PC.
EL5241	SNHG16	Homo sapiens	Cell proliferation	N/A	Transcription regulation	Disease treatment	lung cancer	Cancer	N/A	N/A	qRT-PCR, knockdown, Western blot, overexpression, Luciferase reporter assays	lung cancer tissues and cell lines, normal and malignant lung tissues were obtained from a total of 30 patients	N/A	up-regulated	interaction	ALDH2	Regulate	down-regulated	lncRNA-Protein	regulation	SNHG16|downregulate|ALDH2|promote|Lung Cancer	35646120	2022	Long Noncoding RNA SNHG16 Regulates the Growth of Human Lung Cancer Cells by Modulating the Expression of Aldehyde Dehydrogenase 2 (ALDH2).
EL5244	SNHG17	Homo sapiens	Disease-relevant functions	N/A	Gene regulation	Disease diagnosis	colorectal cancer	Cancer	N/A	N/A	knockdown	colorectal cancer	N/A	up-regulated	interaction	EZH2	Regulate	N/A	lncRNA-Protein	binding	lncRNA SNHG17丨suppress丨P57丨by丨binding to丨enhancer of zeste homolog 2丨correlated with丨those of P57 in CRC tissues	28933484	2017	SNHG17 was upregulated in CRC tissues, and that its overexpression was significantly correlated with tumor size, TNM stage, and lymph node metastasis in CRC patients.
EL5244	SNHG17	Homo sapiens	gefitinib resistance	N/A	Recruiting protein complexes	Therapeutic target	lung adenocarcinoma	Cancer	N/A	N/A	qRT-PCR, ChIP, RIP, FISH, gain- and loss-of functions assays	gefitinib-resistant LUAD tissues and cell lines	N/A	up-regulated	interaction	EZH2	Regulate	up-regulated	lncRNA-Protein	binding	SNHG17 |bind|EZH2|downregulate|LATS2 expression|promote|LUAD gefitinib resistance	35902569	2022	m6A methyltransferase METTL3-induced lncRNA SNHG17 promotes lung adenocarcinoma gefitinib resistance by epigenetically repressing LATS2 expression.
EL5248	SNHG20	Homo sapiens	Disease-relevant functions	N/A	Gene regulation	Disease diagnosis	hepatocellular carcinoma	Cancer	N/A	N/A	qRT-PCR, western-blotting, knockdown	96 paired HCC tissues and cell lines	N/A	up-regulated	interaction	EZH2	Regulate	N/A	lncRNA-Protein	binding	SNHG20丨bind to丨enhancer of zeste homolog 2 (EZH2)丨regulated丨E-cadherin expression	28282787	2017	SNHG20/EZH2/E-cadhein regulator pathway might contribute to the development of novel therapeutic strategies for HCC patients.
EL5250	SNHG22	Homo sapiens	Disease-relevant functions	N/A	Sponging miRNAs	Disease treatment	gastric cancer	Cancer	N/A	N/A	RNA Pull-down, knockdown	gastric cancer cells	N/A	up-regulated	interaction	EZH2	Regulate	down-regulated	lncRNA-Protein	binding	ELK4|upregulate|SNHG22|bind|EZH2, miR-200c-3p|Notch1 axis| promote| gastric cancer progression	34663788	2021	ELK4-mediated LncRNA SNHG22 promotes gastric cancer progression through interacting with EZH2 and regulating miR-200c-3p/Notch1 axis.
EL5254	SNHG26	Homo sapiens	EMT	N/A	Decoy for hijacking proteins	Promote disease	tongue squamous cell carcinoma	Cancer	cisplatin	N/A	qRT-PCR, knockdown, Western blot, overexpression, Luciferase reporter assays	CAL27, CDDP, CAL27	N/A	up-regulated	interaction	PGK1	Regulate	down-regulated	lncRNA-Protein	binding	SNHG26| bind|PGK1|activate|Akt / mTOR| promote|tongue squamous cell carcinoma	35118193	2021	in TSCC cells, SNHG26 was found to bind directly to the PGK1 protein, inhibiting its ubiquitination and activating the Akt/mTOR signaling pathway.
EL5263	SNHG6	Homo sapiens	EMT	N/A	Gene regulation	Promote disease	gastric cancer	Cancer	N/A	N/A	qRT-PCR, western blotting,immunofuorescence, ChIP, RIP, RNA-pulldown, luciferase reporter assays	gastric cancer tissues and cell lines	N/A	up-regulated	interaction	EZH2	Regulate	N/A	lncRNA-Protein	binding	SNHG6丨acted as丨an oncogene丨in gastric cancer cells丨through丨regulating丨miR-101-3p/ZEB1丨by 丨recruiting丨enhancer of zeste homolog 2 (EZH2)丨to丨the promoter of p27	28683446	2017	Silenced SNHG6 obviously inhibited gastric cancer cell growth, weakened cell migration capacity and suppressed the EMT processes of gastric cancer cells
EL5263	SNHG6	Homo sapiens	Disease-relevant functions	N/A	Signaling pathways regulation	Disease diagnosis	gastric cancer	Cancer	N/A	N/A	qRT-PCR, FISH, Knockdown,	gastric cancer cells.	N/A	up-regulated	interaction	EZH2	Regulate	N/A	lncRNA-Protein	binding	Knockdown of SNHG6丨stimulated丨p21 expression丨	30031062	2018	Long noncoding RNA SNHG6 regulates p21 expression via activation of the JNK pathway and regulation of EZH2 in gastric cancer cells.
EL5263	SNHG6	Homo sapiens	Disease-relevant functions	Nucleolus	Decoy for hijacking proteins	Promote disease	chondrosarcoma	Cancer	N/A	N/A	qRT-PCR	Chondrosarcoma cell lines	N/A	up-regulated	interaction	EZH2	Regulate	up-regulated	lncRNA-Protein	binding	SNHG6|bind|EZH2|downregulate|KLF6|promote|chondrosarcoma	33431838	2021	SP1-induced SNHG6 forms a positive loop to facilitate the carcinogenesis of chondrosarcoma through the suppression of KLF6 by recruiting EZH2, which manifests the oncogenic function of SNHG6 in chondrosarcoma.
EL5263	SNHG6	Homo sapiens	Disease-relevant functions	N/A	Recruiting protein complexes	Promote disease	non-small cell lung cancer	Cancer	N/A	N/A	qRT-PCR, knockdown, Western blot, overexpression, Luciferase reporter assays	non-small cell lung cancer cells	N/A	up-regulated	interaction	EZH2	Regulate	down-regulated	lncRNA-Protein	binding	SNHG6|bind|EZH2|downregulate|p27|promote|non-small cell lung cancer	36494339	2022	Gene amplification-driven lncRNA SNHG6 promotes tumorigenesis via epigenetically suppressing p27 expression and regulating cell cycle in non-small cell lung cancer.
EL5263	SNHG6	Homo sapiens	Disease-relevant functions	N/A	Transcription regulation	Disease diagnosis	colorectal cancer	Cancer	N/A	N/A	ChIRP-MS, qRT-PCR	CRC cells	N/A	up-regulated	interaction	PKM	Regulate	N/A	lncRNA-RNA	binding	SNHG6丨bind to丨hnRNPA1丨and丨PKM	32296635	2020	SNHG6 was found to be able to target the mRNA of PKM as well as induce hnRNPA1 to specifically splice PKM mRNA, which increased the proportion of PKM2/PKM1.
EL5266	SNHG7	Homo sapiens	Cell proliferation	N/A	DNA damage response	Promote disease	osteosarcoma	Cancer	N/A	N/A	qRT-PCR, western blot, knockdown, Rescue experiments, RIP, CHIP	osteosarcoma cells, tumor tissues	N/A	up-regulated	interaction	DNMT1	Regulate	N/A	lncRNA-Protein	binding	SNHG7丨inhibited丨the expression of p53丨by丨binding to丨DNMT3	31114984	2019	Highly expressed SNHG7 can promote the proliferation and inhibit apoptosis of osteosarcoma cells by regulating p53 expression by binding to DNMT1.
EL5270	SNHG8	Homo sapiens	Disease-relevant functions	N/A	Transcription regulation	Promote disease	cervical cancer	Cancer	N/A	N/A	Knockdown, qRT-PCR, FISH, ChIP	cervical cancer cells, HPV-negative CC cells	N/A	up-regulated	interaction	EZH2	Regulate	N/A	lncRNA-Protein	binding	SNHG8丨disclosed to丨interact with丨enhancer of zeste homolog 2 (EZH2) based on RNA immunoprecipitation assay	31961005	2020	Altogether, it reflected that SNHG8 recruited EZH2 to downregulate RECK expression, leading to HPV-induced CC aggravation.
EL5270	SNHG8	Homo sapiens	Cell Differentiation	Nucleus	Recruiting protein complexes	Disease treatment	N/A	N/A	N/A	N/A	qRT-PCR, knockdown, Western blot, overexpression, Luciferase reporter assays, ChIP, FISH	periodontal ligament stem cells	N/A	down-regulated	interaction	EZH2	Regulate	down-regulated	lncRNA-Protein	regulation	SNHG8 | regulate |EZH2 expression | promote | osteogenic differentiation	35192931	2022	downregulation of SNHG8 led to lower expression of enhancer of zeste homolog 2 (EZH2), which negatively regulated the osteogenic differentiation of PDLSCs.
EL5284	SOX21-AS1	Homo sapiens	Disease-relevant functions	N/A	Transcription regulation	Therapeutic target	hepatocellular carcinoma	Cancer	N/A	N/A	qRT-PCR, RIP, ChIp, rescue assays, knockdown	tumor tissues and cell	N/A	up-regulated	interaction	EZH2	Regulate	N/A	lncRNA-TF	binding	SOX21-AS1丨bind with丨EZH2丨silenced丨p21丨via丨recruiting丨EZH2丨to丨the promoter of p21	29772433	2018	SOX21-AS1 can interact with p21 to affect hepatocellular carcinoma progression. SOX21-AS1 could be a potential prognostic biomarker or a therapeutic target for hepatocellular carcinoma.
EL5289	SOX2-OT	Homo sapiens	Disease-relevant functions	N/A	Transcription regulation	Promote disease	laryngeal squamous cell carcinoma	Cancer	N/A	N/A	overexpression, knockdown,	LSCC tissues	N/A	up-regulated	interaction	EZH2	Regulate	N/A	lncRNA-Protein	binding	SOX2-OT丨interacted with丨EZH2丨recruited丨EZH2丨to丨induce丨H3K27me3丨inhibited丨PTEN expression in LSCC cells	30811870	2019	Long noncoding RNA SOX2-OT facilitates laryngeal squamous cell carcinoma development by epigenetically inhibiting PTEN via methyltransferase EZH2.
EL5289	SOX2-OT	Homo sapiens	oxidative stress and apoptosis of renal tubular epithelial cells	N/A	Regulating complex interactions	Inhibit disease	diabetic nephropathy	Others	high glucose	N/A	qRT-PCR, Western blot, Luciferase reporter assays, RNA pull-down	the human kidney-2 (HK-2) cells were treated with HG	N/A	down-regulated	interaction	SIRT1	Regulate	up-regulated	lncRNA-Protein	regulation	SOX2OT|upregulate|SIRT1|inhibit|diabetic nephropathy	36576135	2023	Foxa2-mediated SOX2OT up-regulation reduced oxidative stress and apoptosis of RTECs by promoting SIRT1 expression, thus alleviating the progression of DN.
EL5304	SPRY4-IT1	Homo sapiens	Disease-relevant functions	N/A	Sponging miRNAs	Promote disease	cholangiocarcinoma	Cancer	N/A	N/A	Luciferase reporter,ChIP,qRT-PCR, Knockdown,	CCA tissues and cells	N/A	up-regulated	interaction	DNMT1	Regulate	N/A	lncRNA-Protein	binding	EZH2 along with LSD1 or DNMT1丨recruited by丨SPRY4-IT3丨functioned as丨a scaffold	29642935	2018	SP1-induced upregulation of lncRNA SPRY4-IT1 exerts oncogenic properties by scaffolding EZH2/LSD1/DNMT1 and sponging miR-101-3p in cholangiocarcinoma.
